{
  "title": "README",
  "general_instruction": "Generate a production-ready README.md for the target codebase. Use only the facts available in the referenced resources (code, docs, configs, tests, etc.). Keep prose short, use bullet lists when helpful, and prefer plain-language explanations over marketing fluff. Assume the audience is a developer seeing the project for the first time.",
  "resources": [
    {
      "key": "codebase_docs",
      "path": "ai_context/generated/RECIPE_EXECUTOR_RECIPE_FILES.md",
      "description": "In-repo design docs, examples, etc."
    },
    {
      "key": "code_files",
      "path": "ai_context/generated/RECIPE_EXECUTOR_CODE_FILES.md",
      "description": "Code files, including scripts and modules."
    }
  ],
  "sections": [
    {
      "title": "Header",
      "prompt": "Produce an H1 title using the repository name. Optionally add shields.io badges for build status, license, or published package version if the information exists.\nWrite a single-sentence summary of what the project does and who it is for, based on the highest-level documentation.",
      "refs": ["codebase_docs", "code_files"]
    },
    {
      "title": "Key Features",
      "prompt": "List the main capabilities or selling points, one bullet per feature, drawing facts from design docs or API specs.",
      "refs": ["codebase_docs", "code_files"]
    },
    {
      "title": "Installation",
      "prompt": "Provide copy-paste installation instructions, including package-manager commands, build steps, and environment variables, using exact data from configuration files.",
      "refs": ["codebase_docs", "code_files"]
    },
    {
      "title": "Usage",
      "prompt": "Show the simplest runnable example pulled from tests, docs, or API specs. If multiple language clients exist, include one example per language.",
      "refs": ["codebase_docs", "code_files"]
    },
    {
      "title": "API Reference",
      "prompt": "If formal API specs exist, generate a short table of endpoints with method, path, and one-line description; otherwise keep the heading with a note indicating N/A.",
      "refs": ["codebase_docs", "code_files"]
    },
    {
      "title": "Architecture Overview",
      "prompt": "Describe the high-level architecture in two or three short paragraphs. If diagrams are available, embed image links and reference major components.",
      "refs": ["codebase_docs", "code_files"]
    }
  ]
}
